{
  "$schema": "./config.schema.json",
  "name": "sample",
  "version": "0.0.1",
  "description": "Some description",
  "authors": [
    {
      "name": "carddamom",
      "url": "https://github.com/carddamom",
      "email": "carddamom@tutanota.com"
    }
  ],
  "files": [
    {
      "name": "Book A",
      "output": "./dist/bookA",
      "path": "./src/bookA/main.md"
    },
    {
      "name": "Book B",
      "output": "./dist/bookB",
      "path": "./src/bookB/main.md"
    }
  ],
  "license": [
    "GPL-3.0-or-later"
  ]
}
